{
  "schema_version": 1,
  "name": "default",
  "description": "Comprehensive warm-cache qualification for Qwen3, Qwen3.5, and LFM2 with fresh-process multi-turn, bounded soak, semantic 4k context retrieval, and 1k/4k benchmark coverage within a 15-minute NPU2 target",
  "models": [
    {
      "tag": "qwen3:0.6b",
      "source": "https://huggingface.co/FastFlowLM/Qwen3-0.6B-NPU2",
      "revision": null,
      "identity_policy": "content-sha256",
      "registry_sha256": "146f5540531a91df0243bbe2e80aca3e0303a6338e36c2f1441eb5a842e8fae6",
      "files": [
        {"path": "config.json", "sha256": "8a5ec72f5c96766168a4024f88d70841ae341900a0c84fd4fd23f8eeae16c6a7"},
        {"path": "model.q4nx", "sha256": "db8dec4dff653817218ff920c5d25d28d1805512906485e654f03980053fa667"},
        {"path": "tokenizer.json", "sha256": "aeb13307a71acd8fe81861d94ad54ab689df773318809eed3cbe794b4492dae4"},
        {"path": "tokenizer_config.json", "sha256": "51015f78470ac7f7b8c128a6b6ee31a0081285a453db4caba9d46104063908a2"}
      ],
      "xclbins": [
        {"path": "Qwen3-0.6B-NPU2/attn.xclbin", "sha256": "88ad573eb558881a8b43117dc8fbb6a0726f381940a00ad941d064e098ab0c65"},
        {"path": "Qwen3-0.6B-NPU2/dequant.xclbin", "sha256": "575d45e47993315f95f601e07f9f21164f30515f80e232e16255d7c5f2a1d4bf"},
        {"path": "Qwen3-0.6B-NPU2/layer.xclbin", "sha256": "9e084785df7c4e37bc4c0de7ab1635c2cd3a18114a319494889d30362e0e6178"},
        {"path": "Qwen3-0.6B-NPU2/mm.xclbin", "sha256": "4afc2a6f2459c0ddcf7de61193a6e83e53a951a0f6c33521456d569bab2c7142"}
      ],
      "tests": [
        {
          "name": "multi-turn",
          "kind": "run",
          "turns": [
            {"prompt": "Reply with the word alpha.", "expected_regex": "alpha"},
            {"prompt": "Reply with the word beta.", "expected_regex": "beta"},
            {"prompt": "Reply with the word gamma.", "expected_regex": "gamma"}
          ],
          "setup_commands": ["/set topk 1", "/set temp 0", "/set gen-lim 16"],
          "process_iterations": 2,
          "timeout_seconds": 300,
          "ctx_len": 1024
        },
        {
          "name": "bounded-soak",
          "kind": "run",
          "turns": [
            {"prompt": "Reply with the word stable.", "expected_regex": "stable"},
            {"prompt": "Reply with the word ready.", "expected_regex": "ready"}
          ],
          "setup_commands": ["/set topk 1", "/set temp 0", "/set gen-lim 16"],
          "process_iterations": 3,
          "timeout_seconds": 300,
          "ctx_len": 1024
        },
        {
          "name": "context-1k",
          "kind": "bench",
          "config": "bench/bench_1k_smoke.json",
          "timeout_seconds": 180,
          "checkpoint_min": 950,
          "checkpoint_max": 1024,
          "expected_regex": ""
        }
      ]
    },
    {
      "tag": "qwen3.5:0.8b",
      "source": "https://huggingface.co/FastFlowLM/Qwen3.5-0.8B-NPU2",
      "revision": "flm_q4k_high_precision",
      "identity_policy": "revision-sha256",
      "registry_sha256": "146f5540531a91df0243bbe2e80aca3e0303a6338e36c2f1441eb5a842e8fae6",
      "files": [
        {"path": "config.json", "sha256": "a571afa7fca18a6ecb4c0c2dbc7758204b442804056280e85d4e2d6c582c70c3"},
        {"path": "model.q4nx", "sha256": "787428ffe87be5e3e5a8fcaf241844b69896ca0c74a41f2432c436739f7ba4e4"},
        {"path": "tokenizer.json", "sha256": "5f9e4d4901a92b997e463c1f46055088b6cca5ca61a6522d1b9f64c4bb81cb42"},
        {"path": "tokenizer_config.json", "sha256": "485aad30cae5f2280d6050a01f9160c435ee5aeabaf4fda7dd59b76ccc8b1f4c"},
        {"path": "vision_weight.q4nx", "sha256": "94e6b19043bf1d07645ee1e0a44b44016abb881801027b39656b7f7872f8fc18"},
        {"path": "chat_template.jinja", "sha256": "0537aa8f59cf80f23dfd42253649959caf944d50f4214ce6b3efb766ce0bd079"}
      ],
      "xclbins": [],
      "tests": [
        {
          "name": "multi-turn",
          "kind": "run",
          "turns": [
            {"prompt": "Name the color of a clear daytime sky in one word.", "expected_regex": "blue"},
            {"prompt": "Name the capital of France in one word.", "expected_regex": "Paris"},
            {"prompt": "Reply with the word five.", "expected_regex": "five"}
          ],
          "setup_commands": ["/set topk 1", "/set temp 0", "/set gen-lim 32"],
          "process_iterations": 2,
          "timeout_seconds": 360,
          "ctx_len": 1024
        },
        {
          "name": "bounded-soak",
          "kind": "run",
          "turns": [
            {"prompt": "Reply with the word stable.", "expected_regex": "stable"},
            {"prompt": "Reply with the word ready.", "expected_regex": "ready"}
          ],
          "setup_commands": ["/set topk 1", "/set temp 0", "/set gen-lim 32"],
          "process_iterations": 3,
          "timeout_seconds": 360,
          "ctx_len": 1024
        },
        {
          "name": "context-1k",
          "kind": "bench",
          "config": "bench/bench_1k_smoke.json",
          "timeout_seconds": 240,
          "checkpoint_min": 950,
          "checkpoint_max": 1024,
          "expected_regex": ""
        }
      ]
    },
    {
      "tag": "lfm2:1.2b",
      "source": "https://huggingface.co/FastFlowLM/LFM2-1.2B-NPU2",
      "revision": null,
      "identity_policy": "content-sha256",
      "registry_sha256": "146f5540531a91df0243bbe2e80aca3e0303a6338e36c2f1441eb5a842e8fae6",
      "files": [
        {"path": "config.json", "sha256": "21c02d2daa253c01a5b1cc08e8b275efc9cbe197abdc1c0bcc71ccfbb37d5ada"},
        {"path": "model.q4nx", "sha256": "2755ab40cd927e3cc2c7068a5108d7ab4b85600e6dd320f97003b7223fde0e2f"},
        {"path": "tokenizer.json", "sha256": "98cff83b4f6d7e9d8929bebc62b07e92cf1b3f99c80d16bafe8b84a75448f40b"},
        {"path": "tokenizer_config.json", "sha256": "cd3f070a04e4fbbc273da7c5f7dfcdebb309845a96e07612c875d155472b2716"}
      ],
      "xclbins": [],
      "tests": [
        {
          "name": "multi-turn",
          "kind": "run",
          "turns": [
            {"prompt": "Reply with the word alpha.", "expected_regex": "alpha"},
            {"prompt": "Reply with the word beta.", "expected_regex": "beta"},
            {"prompt": "Reply with the word gamma.", "expected_regex": "gamma"}
          ],
          "setup_commands": ["/set topk 1", "/set temp 0", "/set gen-lim 16"],
          "process_iterations": 2,
          "timeout_seconds": 360,
          "ctx_len": 1024
        },
        {
          "name": "bounded-soak",
          "kind": "run",
          "turns": [
            {"prompt": "Reply with the word stable.", "expected_regex": "stable"},
            {"prompt": "Reply with the word ready.", "expected_regex": "ready"}
          ],
          "setup_commands": ["/set topk 1", "/set temp 0", "/set gen-lim 16"],
          "process_iterations": 3,
          "timeout_seconds": 360,
          "ctx_len": 1024
        },
        {
          "name": "context-4k-retrieval",
          "kind": "run",
          "turns": [
            {
              "prompt_generator": {
                "schema_version": 1,
                "kind": "context-tail-marker-v1",
                "filler_word_count": 3200,
                "marker_word_offset": 3120,
                "marker": "HRX-NPU-CONTEXT-4K-PASS"
              },
              "expected_regex": "HRX[- ]NPU[- ]CONTEXT[- ]4K[- ]PASS"
            }
          ],
          "setup_commands": ["/set topk 1", "/set temp 0", "/set gen-lim 32"],
          "process_iterations": 1,
          "timeout_seconds": 360,
          "ctx_len": 4096
        },
        {
          "name": "context-1k",
          "kind": "bench",
          "config": "bench/bench_1k_smoke.json",
          "timeout_seconds": 240,
          "checkpoint_min": 950,
          "checkpoint_max": 1024,
          "expected_regex": ""
        },
        {
          "name": "context-4k",
          "kind": "bench",
          "config": "bench/bench_4k_smoke.json",
          "timeout_seconds": 360,
          "checkpoint_min": 3800,
          "checkpoint_max": 4096,
          "expected_regex": ""
        }
      ]
    }
  ]
}
