{
  "schema_version": 1,
  "name": "fast",
  "description": "Bounded CI parity qualification: five fresh Qwen3 processes, two deterministic turns, production XCLBIN pins, and a validated 1k benchmark",
  "models": [
    {
      "tag": "qwen3:0.6b",
      "source": "https://huggingface.co/FastFlowLM/Qwen3-0.6B-NPU2",
      "revision": null,
      "identity_policy": "content-sha256",
      "registry_sha256": "aadb182e86a18620d4805816ff8072bc3d524b7fc7ceb7bdc8a24c850a09bce5",
      "files": [
        {"path": "config.json", "sha256": "8a5ec72f5c96766168a4024f88d70841ae341900a0c84fd4fd23f8eeae16c6a7"},
        {"path": "model.q4nx", "sha256": "db8dec4dff653817218ff920c5d25d28d1805512906485e654f03980053fa667"},
        {"path": "tokenizer.json", "sha256": "aeb13307a71acd8fe81861d94ad54ab689df773318809eed3cbe794b4492dae4"},
        {"path": "tokenizer_config.json", "sha256": "51015f78470ac7f7b8c128a6b6ee31a0081285a453db4caba9d46104063908a2"}
      ],
      "xclbins": [
        {"path": "Qwen3-0.6B-NPU2/attn.xclbin", "sha256": "88ad573eb558881a8b43117dc8fbb6a0726f381940a00ad941d064e098ab0c65"},
        {"path": "Qwen3-0.6B-NPU2/dequant.xclbin", "sha256": "575d45e47993315f95f601e07f9f21164f30515f80e232e16255d7c5f2a1d4bf"},
        {"path": "Qwen3-0.6B-NPU2/layer.xclbin", "sha256": "9e084785df7c4e37bc4c0de7ab1635c2cd3a18114a319494889d30362e0e6178"},
        {"path": "Qwen3-0.6B-NPU2/mm.xclbin", "sha256": "4afc2a6f2459c0ddcf7de61193a6e83e53a951a0f6c33521456d569bab2c7142"}
      ],
      "tests": [
        {
          "name": "ci-multi-turn",
          "kind": "run",
          "turns": [
            {"prompt": "Repeat exactly: HRX runtime smoke test one.", "expected": "HRX runtime smoke test one."},
            {"prompt": "Repeat exactly: HRX runtime smoke test two.", "expected": "HRX runtime smoke test two."}
          ],
          "setup_commands": ["/set topk 1", "/set temp 0", "/set gen-lim 16"],
          "process_iterations": 5,
          "timeout_seconds": 300,
          "ctx_len": 1024
        },
        {
          "name": "context-1k",
          "kind": "bench",
          "config": "bench/bench_1k_smoke.json",
          "timeout_seconds": 180,
          "checkpoint_min": 950,
          "checkpoint_max": 1024,
          "expected_regex": ""
        }
      ]
    }
  ]
}
